defName,label,description,graphicData/texPath,graphicData/graphicClass,soundInteract,costStuffCount,statBases/WorkToMake,statBases/MeleeWeapon_DamageAmount,statBases/MeleeWeapon_Cooldown,equippedAngleOffset,stuffCategories/li/0,stuffCategories/li/1,verbs/li/verbClass,verbs/li/hasStandardCommand,verbs/li/meleeDamageDef,_ParentName,stuffCategories/li,tradeability,statBases/DeteriorationRate,stuffCategories/li/2,recipeMaker/recipeUsers/li/0,recipeMaker/recipeUsers/li/1,recipeMaker/recipeUsers/li/2,techLevel,weaponTags/li/0,weaponTags/li/1
MeleeWeapon_Gladius,gladius,A short sword of ancient design. Good for stabbing or slashing.,Things/Item/Equipment/WeaponMelee/Gladius,Graphic_Single,InteractPistol,50,20000,12,1.95,-65,Metallic,Woody,Verb_MeleeAttack,true,Cut,BaseMeleeWeapon_Sharp,,,,,,,,,,
MeleeWeapon_LongSword,longsword,"The ancient weapon of kings, the longsword can be used for slashing or stabbing and is deadly in the right hands.",Things/Item/Equipment/WeaponMelee/LongSword,Graphic_Single,InteractPistol,120,40000,17,2.5,-65,Metallic,Woody,Verb_MeleeAttack,true,Cut,BaseMeleeWeapon_Sharp,,,,,,,,,,
MeleeWeapon_Knife,knife,"One of humankind's oldest tools, the knife is both an everyday tool and a deadly weapon.",Things/Item/Equipment/WeaponMelee/Knife,Graphic_Single,InteractPistol,40,6000,8,1.66,-65,,,Verb_MeleeAttack,true,Cut,BaseMeleeWeapon_Sharp,Metallic,,,,,,,,,
MeleeWeapon_Shiv,shiv,An improvised knife-like weapon.,Things/Item/Equipment/WeaponMelee/Shiv,Graphic_Single,InteractPistol,10,300,7,1.55,-65,Metallic,Woody,Verb_MeleeAttack,true,Cut,BaseMeleeWeapon_Sharp,,Sellable,0.5,Stony,ElectricSmithy,FueledSmithy,CraftingSpot,,,
MeleeWeapon_Spear,spear,A polearm tipped with a sharp point for stabbing opponents in melee combat.,Things/Item/Equipment/WeaponMelee/Spear,Graphic_Single,,90,25000,15,2.3,-25,Metallic,Woody,Verb_MeleeAttack,true,Stab,BaseMeleeWeapon_Sharp,,,,,,,,Neolithic,Neolithic,NeolithicMelee
MeleeWeapon_Mace,mace,"A refined club, engineered for efficient swinging and deadly impacts.",Things/Item/Equipment/WeaponMelee/Mace,Graphic_Single,,75,15000,11,2.1,-65,Metallic,Woody,Verb_MeleeAttack,true,Blunt,BaseMeleeWeapon_Blunt,,,,,,,,,,
MeleeWeapon_Club,club,"The oldest human weapon - a shaped stick, heavy at one end, for bashing enemies to death. Primitive but effective.",Things/Item/Equipment/WeaponMelee/Club,Graphic_Single,,40,500,11,2.4,-65,Metallic,Woody,Verb_MeleeAttack,true,Blunt,BaseMeleeWeapon_Blunt,,Sellable,0.5,Stony,ElectricSmithy,FueledSmithy,CraftingSpot,Neolithic,Neolithic,NeolithicMelee
